{
  "schema_version": "1.0.0",
  "registry_id": "metaautomate-engineering-capability-registry",
  "as_of_date": "2026-10-16",
  "purpose": "Read-only, source-controlled engineering inventory; not the executable capability catalog or authorization plane.",
  "relationship": {
    "existing_catalog": "docs/registry/capabilities.csv",
    "existing_definition_schema": "docs/registry/capability.schema.json",
    "contract": "Engineering entries cross-reference all existing draft catalog IDs; legacy database seeding and APIs remain unchanged."
  },
  "release_boundary": {
    "foundation_evidence": "docs/operational-core/FOUNDATION_EXIT_EVIDENCE.json",
    "required_policy": "NO_GO_UNTIL_ALL_NINE_VERIFIED",
    "operational_authorization": "NO_GO",
    "all_capabilities_disabled": true,
    "reference_deploy": "marketing website only, not a platform deployment"
  },
  "maturity_definitions": {
    "VISION": "Concept or long-term intent without implemented code for this capability.",
    "SOURCE_CANDIDATE": "Relevant engineering source exists but does not implement the entire claimed capability.",
    "SOURCE_TESTED": "Bounded source implementation has test definitions; independent operational release is NOT verified.",
    "LOCAL_SYNTHETIC_DEMO": "Only local, fabricated-data demo behavior is represented; NOT customer data or live provider connectivity."
  },
  "security_control_definitions": {
    "TENANT_ISOLATION": "Prove tenant boundaries and deny cross-tenant access.",
    "LEAST_PRIVILEGE": "Use least-privilege identities and scoped permissions.",
    "EXPLICIT_APPROVAL": "Obtain per-action authorization and human approval before effects.",
    "AUDIT_TRAIL": "Preserve tamper-evident receipts and accountability for permitted operations.",
    "PRIVACY_CONTROLS": "Validate consent, minimization, retention and data protection.",
    "INDEPENDENT_VERIFICATION": "Supply tests, negative cases and independent acceptance evidence.",
    "STAGING_SECURITY": "Prove approved private staging, secure ingress and MFA.",
    "RECOVERY_EVIDENCE": "Verify independent off-host backup, restore and incident recovery.",
    "EXTERNAL_ACTION_DENY": "Block all external writes, publishing and payment without separate release.",
    "CONTENT_RIGHTS": "Verify rights to content, likenesses, media and platform terms.",
    "DOMAIN_EXPERT_REVIEW": "Require qualified review and cited sources for sensitive or religious guidance."
  },
  "entries": [
    {
      "id": "CAP-AI",
      "kind": "technology_area",
      "name": "AI Agents & Orchestration",
      "maturity": "SOURCE_CANDIDATE",
      "operational_status": "NO_GO",
      "implementation_scope": "Authenticated AMBOY M1 dry-run gateway only; no models, tool calls or autonomous agents",
      "modules": [
        {
          "path": "apps/api/app/amboy_m1.py",
          "scope": "source_reference"
        }
      ],
      "verification_evidence": [
        {
          "path": "tests/test_amboy_contracts.py",
          "kind": "test_definition",
          "note": "Dry-run negative contract tests"
        }
      ],
      "security_requirements": [
        "TENANT_ISOLATION",
        "EXPLICIT_APPROVAL",
        "EXTERNAL_ACTION_DENY",
        "AUDIT_TRAIL"
      ],
      "depends_on": [
        "SYS-ORCHESTRATION",
        "SYS-IDENTITY"
      ],
      "catalog_ids": [
        "PER-001",
        "PER-002",
        "PER-003",
        "PER-004",
        "PER-005",
        "PER-006"
      ],
      "unmet_release_gates": [
        "F04",
        "F05",
        "F06",
        "F07",
        "F08",
        "F09"
      ],
      "risk_class": "HIGH",
      "known_limitations": "M1 does not perform model inference or customer-facing agent orchestration.",
      "next_acceptance": "Obtain approved private staging, validated tenant and action authorization, and independently signed release evidence before any real customer operation."
    },
    {
      "id": "CAP-MEDIA",
      "kind": "technology_area",
      "name": "Image & Video Generation",
      "maturity": "VISION",
      "operational_status": "NO_GO",
      "implementation_scope": "Future rights-aware creation workflows and professional media production",
      "modules": [],
      "verification_evidence": [],
      "security_requirements": [
        "CONTENT_RIGHTS",
        "EXPLICIT_APPROVAL",
        "PRIVACY_CONTROLS"
      ],
      "depends_on": [
        "SYS-CREATION"
      ],
      "catalog_ids": [
        "CRE-001",
        "CRE-002",
        "CRE-003"
      ],
      "unmet_release_gates": [
        "F04",
        "F05",
        "F06",
        "F07",
        "F08",
        "F09"
      ],
      "risk_class": "MEDIUM",
      "known_limitations": "No implemented media-generation engine, paid service or production creative pipeline.",
      "next_acceptance": "Obtain approved private staging, validated tenant and action authorization, and independently signed release evidence before any real customer operation."
    },
    {
      "id": "CAP-SOCIAL",
      "kind": "technology_area",
      "name": "Social Media Automation",
      "maturity": "VISION",
      "operational_status": "NO_GO",
      "implementation_scope": "Future editorial plans, approval-based scheduling and analytics",
      "modules": [],
      "verification_evidence": [],
      "security_requirements": [
        "EXPLICIT_APPROVAL",
        "CONTENT_RIGHTS",
        "PRIVACY_CONTROLS",
        "EXTERNAL_ACTION_DENY"
      ],
      "depends_on": [
        "SYS-CREATION",
        "SYS-INTEGRATIONS"
      ],
      "catalog_ids": [
        "CRE-004",
        "CRE-005",
        "BIZ-008",
        "BIZ-009"
      ],
      "unmet_release_gates": [
        "F04",
        "F05",
        "F06",
        "F07",
        "F08",
        "F09"
      ],
      "risk_class": "MEDIUM",
      "known_limitations": "No production social-publishing integration or authorized autonomous posting.",
      "next_acceptance": "Obtain approved private staging, validated tenant and action authorization, and independently signed release evidence before any real customer operation."
    },
    {
      "id": "CAP-SOFTWARE",
      "kind": "technology_area",
      "name": "Software Engineering",
      "maturity": "SOURCE_TESTED",
      "operational_status": "NO_GO",
      "implementation_scope": "Existing API source and public static website; not a general-purpose customer app builder",
      "modules": [
        {
          "path": "apps/api/app/main.py",
          "scope": "source_reference"
        },
        {
          "path": "apps/site/index.html",
          "scope": "source_reference"
        }
      ],
      "verification_evidence": [
        {
          "path": "tests/test_site_customer_clarity.py",
          "kind": "test_definition",
          "note": "Marketing-site content, privacy and claim checks"
        },
        {
          "path": "apps/api/tests/test_api.py",
          "kind": "test_definition",
          "note": "API behavior test definitions"
        }
      ],
      "security_requirements": [
        "INDEPENDENT_VERIFICATION",
        "LEAST_PRIVILEGE",
        "PRIVACY_CONTROLS"
      ],
      "depends_on": [
        "SYS-VERIFICATION",
        "SYS-IDENTITY"
      ],
      "catalog_ids": [],
      "unmet_release_gates": [
        "F04",
        "F05",
        "F06",
        "F07",
        "F08",
        "F09"
      ],
      "risk_class": "MEDIUM",
      "known_limitations": "Next.js application is only a scaffold; source tests are not customer-release certification.",
      "next_acceptance": "Obtain approved private staging, validated tenant and action authorization, and independently signed release evidence before any real customer operation."
    },
    {
      "id": "CAP-SECURITY",
      "kind": "technology_area",
      "name": "Cybersecurity & QA",
      "maturity": "SOURCE_TESTED",
      "operational_status": "NO_GO",
      "implementation_scope": "Security policy and negative tests for private source/CI only",
      "modules": [
        {
          "path": "apps/api/app/authn.py",
          "scope": "source_reference"
        },
        {
          "path": "apps/api/app/workspace_auth.py",
          "scope": "source_reference"
        }
      ],
      "verification_evidence": [
        {
          "path": "tests/test_private_oidc_contract.py",
          "kind": "test_definition",
          "note": "Private OIDC source contract tests"
        },
        {
          "path": "tests/test_validation_gate.py",
          "kind": "test_definition",
          "note": "Validation and rejection cases"
        }
      ],
      "security_requirements": [
        "TENANT_ISOLATION",
        "LEAST_PRIVILEGE",
        "INDEPENDENT_VERIFICATION",
        "STAGING_SECURITY"
      ],
      "depends_on": [
        "SYS-IDENTITY",
        "SYS-VERIFICATION"
      ],
      "catalog_ids": [],
      "unmet_release_gates": [
        "F04",
        "F05",
        "F06",
        "F07",
        "F08",
        "F09"
      ],
      "risk_class": "HIGH",
      "known_limitations": "Live independent penetration testing and production security acceptance are missing.",
      "next_acceptance": "Obtain approved private staging, validated tenant and action authorization, and independently signed release evidence before any real customer operation."
    },
    {
      "id": "CAP-DATA",
      "kind": "technology_area",
      "name": "Data Analysis & Research",
      "maturity": "LOCAL_SYNTHETIC_DEMO",
      "operational_status": "NO_GO",
      "implementation_scope": "Bounded invented inventory CSV/JSON preview and calculations; no real customer research or ingestion",
      "modules": [
        {
          "path": "apps/api/app/synthetic_inventory_import.py",
          "scope": "source_reference"
        }
      ],
      "verification_evidence": [
        {
          "path": "tests/test_phase02_synthetic_import.py",
          "kind": "test_definition",